<?xml version="1.0" encoding="UTF-8"?>
<metodo xmlns:xsi="http://www.w3.org/2001/XMLSchema-instance"
 xsi:noNamespaceSchemaLocation="metodos-cli.xsd">
	<obter>
		<tabuleiro estado="ND">
			<casa simbolo="X" />
			<casa simbolo="2" />
			<casa simbolo="3" />
			<casa simbolo="4" />
			<casa simbolo="5" />
			<casa simbolo="6" />
			<casa simbolo="7" />
			<casa simbolo="8" />
			<casa simbolo="9" />
		</tabuleiro>
	</obter>
</metodo>