<?xml version="1.0" encoding="UTF-8"?>
<metodo xmlns:xsi="http://www.w3.org/2001/XMLSchema-instance"
	xsi:noNamespaceSchemaLocation="metodos-cli.xsd">
	<obter>
		<tabuleiro estado="EM">
			<casa simbolo="X" />
			<casa simbolo="O" />
			<casa simbolo="X" />
			<casa simbolo="O" />
			<casa simbolo="X" />
			<casa simbolo="O" />
			<casa simbolo="X" />
			<casa simbolo="O" />
			<casa simbolo="X" />
		</tabuleiro>
	</obter>
</metodo>